<?xml version="1.0" encoding="UTF-8" standalone="no"?>
<root xmlns:xsi="http://www.w3.org/2001/XMLSchema-instance" xsi:noNamespaceSchemaLocation="user.xsd">
    <user>
        <id_user>1</id_user>
        <first_name>Mark</first_name>
        <last_name>Smoliak</last_name>
        <sex>male</sex>
        <email>smoliak23@gmail.com</email>
        <date_of_birth>2003-12-18</date_of_birth>
        <taxes/>
    </user>
</root>
